id_cargo,nombre,descripcion
1,Gerente,Encargado de la dirección de alguna área.
2,Jefe,Persona que tiene autoridad sobre un grupo de trabajadores
3,Especialista,Persona con conocimientos específicos en un área determinada.
4,Supervisor,Encargado de supervisar y coordinar las actividades de un grupo de trabajadores.
5,Técnico,Persona con conocimientos técnicos especializados en una determinada área.
6,Profesional,Persona con formación académica y experiencia en un campo específico.
7,Asistente,Persona que brinda apoyo administrativo o técnico en una organización.
8,Operario,Persona encargada de realizar tareas operativas o de producción en una empresa.
